{
  "schema_version": "1.0.0",
  "input_article_row_count": 471,
  "content_hydration_count": 471,
  "lightweight_semantic_review_count": 0,
  "decisions": [
    {
      "row_id": "row-29deef612c7b1d95b41dc5bf",
      "candidate_id": "fc284144940e57ec5221",
      "source_id": "cna",
      "canonical_url": "https://www.cna.com.tw/news/aspt/202609070009.aspx",
      "route": "content_hydration",
      "reasons": [
        "regional_supplement_complete_admission"
      ],
      "matched_discovery_signals": {}
    },
    {
      "row_id": "row-bec9b2eede951ebe4e85593a",
      "candidate_id": "bb26312570d92de2aadc",
      "source_id": "chinanews",
      "canonical_url": "https://www.chinanews.com.cn/tp/hd2011/2026/09-06/1203352.shtml",
      "route": "content_hydration",
      "reasons": [
        "regional_supplement_complete_admission"
      ],
      "matched_discovery_signals": {}
    },
    {
      "row_id": "row-ef9d19b6c6b4ce699b9469ca",
      "candidate_id": "94191e18d926708ed561",
      "source_id": "chinanews",
      "canonical_url": "https://www.chinanews.com.cn/tp/hd2011/2026/09-06/1203341.shtml",
      "route": "content_hydration",
      "reasons": [
        "regional_supplement_complete_admission"
      ],
      "matched_discovery_signals": {}
    },
    {
      "row_id": "row-86bdb3701aa2af23c57a22e1",
      "candidate_id": "2210b5fccba624fce8e5",
      "source_id": "chinanews",
      "canonical_url": "https://www.chinanews.com.cn/tp/hd2011/2026/09-06/1203335.shtml",
      "route": "content_hydration",
      "reasons": [
        "regional_supplement_complete_admission"
      ],
      "matched_discovery_signals": {}
    },
    {
      "row_id": "row-9fe97e2d653b1087352ed1cd",
      "candidate_id": "99984354a4843b4cebf6",
      "source_id": "chinanews",
      "canonical_url": "https://www.chinanews.com.cn/tp/hd2011/2026/09-06/1203324.shtml",
      "route": "content_hydration",
      "reasons": [
        "regional_supplement_complete_admission"
      ],
      "matched_discovery_signals": {}
    },
    {
      "row_id": "row-24d881cea4adda27f5844abc",
      "candidate_id": "3ff65dad647eb7460972",
      "source_id": "chinanews",
      "canonical_url": "https://www.chinanews.com.cn/tp/hd2011/2026/09-06/1203309.shtml",
      "route": "content_hydration",
      "reasons": [
        "regional_supplement_complete_admission"
      ],
      "matched_discovery_signals": {}
    },
    {
      "row_id": "row-4fcc83003b03cfa69e21aeb9",
      "candidate_id": "4d697e7bfce73ca7618c",
      "source_id": "chinanews",
      "canonical_url": "https://www.chinanews.com.cn/shipin/cns/2026/09-06/news1067925.shtml",
      "route": "content_hydration",
      "reasons": [
        "regional_supplement_complete_admission"
      ],
      "matched_discovery_signals": {}
    },
    {
      "row_id": "row-8d6c1553c99b7d40ebbd587d",
      "candidate_id": "5c88c422064b4eeae870",
      "source_id": "chinanews",
      "canonical_url": "https://www.chinanews.com.cn/shipin/2026/09-06/news1067922.shtml",
      "route": "content_hydration",
      "reasons": [
        "regional_supplement_complete_admission"
      ],
      "matched_discovery_signals": {}
    },
    {
      "row_id": "row-51c55da0606aa57dd2791865",
      "candidate_id": "be20241244bf13bdf62c",
      "source_id": "chinanews",
      "canonical_url": "https://www.chinanews.com.cn/shipin/2026/09-06/news1067906.shtml",
      "route": "content_hydration",
      "reasons": [
        "regional_supplement_complete_admission"
      ],
      "matched_discovery_signals": {}
    },
    {
      "row_id": "row-91860fd0fae40e55a6138ef3",
      "candidate_id": "ad7c9000521120c3e2e8",
      "source_id": "chinanews",
      "canonical_url": "https://www.chinanews.com.cn/sh/shipin/cns/2026/09-06/news1067923.shtml",
      "route": "content_hydration",
      "reasons": [
        "regional_supplement_complete_admission"
      ],
      "matched_discovery_signals": {}
    },
    {
      "row_id": "row-db19ef8ed5288d5081d1bcf6",
      "candidate_id": "8ca3a2c1ebc3e91d0266",
      "source_id": "chinanews",
      "canonical_url": "https://www.chinanews.com.cn/sh/shipin/cns-d/2026/09-06/news1067924.shtml",
      "route": "content_hydration",
      "reasons": [
        "regional_supplement_complete_admission"
      ],
      "matched_discovery_signals": {}
    },
    {
      "row_id": "row-28ab2b5c711f9d74bcb321cf",
      "candidate_id": "536ff47002ff5aa02d68",
      "source_id": "chinanews",
      "canonical_url": "https://www.chinanews.com.cn/tp/hd2011/2026/09-06/1203318.shtml",
      "route": "content_hydration",
      "reasons": [
        "regional_supplement_complete_admission"
      ],
      "matched_discovery_signals": {}
    },
    {
      "row_id": "row-23f6fed20d9e2f742dd255f2",
      "candidate_id": "b7f3d1029ef2fc3c9d70",
      "source_id": "chinanews",
      "canonical_url": "https://www.chinanews.com.cn/tp/hd2011/2026/09-06/1203317.shtml",
      "route": "content_hydration",
      "reasons": [
        "regional_supplement_complete_admission"
      ],
      "matched_discovery_signals": {}
    },
    {
      "row_id": "row-00ef5ac03002905a682f10cc",
      "candidate_id": "2208e4f1f33196d7efdc",
      "source_id": "chinanews",
      "canonical_url": "https://www.chinanews.com.cn/tp/hd2011/2026/09-06/1203301.shtml",
      "route": "content_hydration",
      "reasons": [
        "regional_supplement_complete_admission"
      ],
      "matched_discovery_signals": {}
    },
    {
      "row_id": "row-bd31fd5af382a455a4c01552",
      "candidate_id": "4f2a41a00db0b6329577",
      "source_id": "chinanews",
      "canonical_url": "https://www.chinanews.com.cn/tp/hd2011/2026/09-06/1203294.shtml",
      "route": "content_hydration",
      "reasons": [
        "regional_supplement_complete_admission"
      ],
      "matched_discovery_signals": {}
    },
    {
      "row_id": "row-10ca5397bb17178562816421",
      "candidate_id": "8a230ab96d1b78680ae4",
      "source_id": "chinanews",
      "canonical_url": "https://www.chinanews.com.cn/tp/hd2011/2026/09-06/1203286.shtml",
      "route": "content_hydration",
      "reasons": [
        "regional_supplement_complete_admission"
      ],
      "matched_discovery_signals": {}
    },
    {
      "row_id": "row-6c30701de4ee1669ce74c70f",
      "candidate_id": "2a10f0d8f721b9b241c6",
      "source_id": "chinanews",
      "canonical_url": "https://www.chinanews.com.cn/common/footer/intro.shtml",
      "route": "content_hydration",
      "reasons": [
        "regional_supplement_complete_admission"
      ],
      "matched_discovery_signals": {}
    },
    {
      "row_id": "row-4541beb3cbd6e224c32d9175",
      "candidate_id": "11e1b3d6424d9c514ed4",
      "source_id": "chinanews",
      "canonical_url": "https://www.chinanews.com.cn/common/footer/contact.shtml",
      "route": "content_hydration",
      "reasons": [
        "regional_supplement_complete_admission"
      ],
      "matched_discovery_signals": {}
    },
    {
      "row_id": "row-9157e9e46ba1efc3effbba1f",
      "candidate_id": "2a615160d4aaa35850b1",
      "source_id": "chinanews",
      "canonical_url": "https://www.chinanews.com.cn/common/footer/aboutus.shtml",
      "route": "content_hydration",
      "reasons": [
        "regional_supplement_complete_admission"
      ],
      "matched_discovery_signals": {}
    },
    {
      "row_id": "row-c1a49639b99fc3472ab1286f",
      "candidate_id": "696cdf9d3a55db1b13fd",
      "source_id": "cna",
      "canonical_url": "https://www.cna.com.tw/news/aloc/202609070008.aspx",
      "route": "content_hydration",
      "reasons": [
        "regional_supplement_complete_admission"
      ],
      "matched_discovery_signals": {}
    },
    {
      "row_id": "row-4e409b43894d57a1b13cc34c",
      "candidate_id": "bf9036b57362f233c8c6",
      "source_id": "cna",
      "canonical_url": "https://www.cna.com.tw/news/aopl/202609070007.aspx",
      "route": "content_hydration",
      "reasons": [
        "regional_supplement_complete_admission"
      ],
      "matched_discovery_signals": {}
    },
    {
      "row_id": "row-212623f71fe12e27c60c5c19",
      "candidate_id": "d93253c49f8952fa30f9",
      "source_id": "cna",
      "canonical_url": "https://www.cna.com.tw/news/aopl/202609070006.aspx",
      "route": "content_hydration",
      "reasons": [
        "regional_supplement_complete_admission"
      ],
      "matched_discovery_signals": {}
    },
    {
      "row_id": "row-9081aabad6571330ccee658b",
      "candidate_id": "003f1b1b99493c751e51",
      "source_id": "cna",
      "canonical_url": "https://www.cna.com.tw/news/aspt/202609070005.aspx",
      "route": "content_hydration",
      "reasons": [
        "regional_supplement_complete_admission"
      ],
      "matched_discovery_signals": {}
    },
    {
      "row_id": "row-d65425d3f7dd9cc52bad3b7d",
      "candidate_id": "d3935e6ce69c61aceb4c",
      "source_id": "cna",
      "canonical_url": "https://www.cna.com.tw/news/ahel/202609070004.aspx",
      "route": "content_hydration",
      "reasons": [
        "regional_supplement_complete_admission"
      ],
      "matched_discovery_signals": {}
    },
    {
      "row_id": "row-792bdb9f53864fca96979bfb",
      "candidate_id": "d1fcdf1bfb2b065d6bb9",
      "source_id": "cna",
      "canonical_url": "https://www.cna.com.tw/news/aopl/202609070003.aspx",
      "route": "content_hydration",
      "reasons": [
        "regional_supplement_complete_admission"
      ],
      "matched_discovery_signals": {}
    },
    {
      "row_id": "row-c5f32e7de91fce53e2153352",
      "candidate_id": "2e2013b55b21fe1126e8",
      "source_id": "cna",
      "canonical_url": "https://www.cna.com.tw/news/aopl/202609070002.aspx",
      "route": "content_hydration",
      "reasons": [
        "regional_supplement_complete_admission"
      ],
      "matched_discovery_signals": {}
    },
    {
      "row_id": "row-4b00dbca78b52edf4d2aac94",
      "candidate_id": "25295513aa1647a4bc56",